72,https://bodybio.com/collections/gut,Product Category Page,,"""Show four products per row"" button (selected)",,,Toggle buttons need to convey their state to screen reader users.,4.1.2 (WCAG 2.0 A),Visual,"Add an `aria-pressed` attribute to this button. Ensure that the `aria-pressed` attribute correctly reflects the state of the button. The value of the attribute should be set to ""true"" when the button is pressed and ""false"" when it's not pressed.",Serious,,Buttons,98,1373,Open,Open,,,,,,,,,,Audit Session,Audit Session,https://hub.accessible360.com/screenshots/1633138,https://hub.accessible360.com/screenshots/1633138,https://hub.accessible360.com/issues/575728/edit,
73,https://bodybio.com/collections/gut,Product Category Page,,"""Sort By"" select",,,Custom select dropdowns can pose accessibility issues for keyboard and/or screen reader users.,"2.1.1 (WCAG 2.0 A), 4.1.2 (WCAG 2.0 A)","Motor / Dexterity,Visual","Preferably, use an HTML `<select>` tag and a properly associated `<label>` tag. 

If a custom look-and-feel is required, please see our [Custom Select Dropdown](https://hub.accessible360.com/kb/articles/438) Knowledge Base article for guidance and code samples.

Once you have decided which type of select dropdown to implement (standard HTML or custom), please make a comment on this issue to let us know, and then include this issue in an upcoming QA or reach out to your CSM to have this content audited. We will then set this issue to Not Applicable and add new issues as needed to address the content.",Critical,,Forms,105,117,Open,Open,,,,,,Yes,,,,Audit Session,Audit Session,https://hub.accessible360.com/screenshots/1633139,https://hub.accessible360.com/screenshots/1633139,https://hub.accessible360.com/issues/575729/edit,https://hub.accessible360.com/kb/articles/438
74,https://bodybio.com/collections/gut,Product Category Page,,Modal dialog,,Filter,The modal dialog container is not labeled.,4.1.2 (WCAG 2.0 A),Visual,"Provide a [label using one of the following methods](https://hub.accessible360.com/kb/articles/820#heading-labelling). All of these solutions are acceptable, but some may be easier to implement than others depending on the content within the modal dialog.

1. Add a heading (preferably an `<h1>`, but `<h2>` is acceptable), then associate it with the modal dialog wrapper by giving that heading a unique `id` and referencing it with an `aria-labelledby` attribute on the wrapper element (the element with `role=""dialog""` and `aria-modal=""true""`).
  * If a heading describing the contents of the modal dialog already exists, you can use that heading instead.
  * This heading is most helpful when it is visible for all users, but for strict WCAG conformance it can be made visible only to screen reader users instead.
1. Alternatively, add an `aria-label` attribute to the wrapper element (the element with `role=""dialog""` and `aria-modal=""true""`) describing the purpose of the modal dialog.",Serious,,Modal Dialogs,112,44,Open,Open,,,,,,,,,,Audit Session,Audit Session,https://hub.accessible360.com/screenshots/1633394,https://hub.accessible360.com/screenshots/1633394,https://hub.accessible360.com/issues/575776/edit,"https://hub.accessible360.com/kb/articles/820, https://hub.accessible360.com/kb/articles/923"
75,https://bodybio.com/collections/gut,Product Category Page,,Modal dialog,,Filter,Closing this modal dialog does not return the user to the element that opened it.,2.4.3 (WCAG 2.0 A),"Motor / Dexterity,Visual","When this modal dialog closes, return focus to the element that triggered this modal dialog to open.

If this element is no longer available on the page, then focus should be moved to another element as close as possible to where that element was.

If this modal dialog was opened automatically when the page loaded, then move focus on to the `<body>` element.",Serious,,Modal Dialogs,112,46,Open,Open,,,,,,,,,,Audit Session,Audit Session,,,https://hub.accessible360.com/issues/575777/edit,"https://hub.accessible360.com/kb/articles/114, https://hub.accessible360.com/kb/articles/820"
76,https://bodybio.com/collections/gut,Product Category Page,,Modal dialog content,,Filter,"This modal dialog closes visually, but the dialog remains visible to screen reader users and can still receive keyboard focus.",4.1.2 (WCAG 2.0 A),"Motor / Dexterity,Visual","Ensure the modal dialog is hidden from screen reader users by either removing it from the DOM, or giving it a CSS property of `display:none` or `visibility:hidden`. ",Serious,,Modal Dialogs,112,102,Open,Open,,,,,,,,,,Audit Session,Audit Session,,,https://hub.accessible360.com/issues/575778/edit,"https://hub.accessible360.com/kb/articles/157, https://hub.accessible360.com/kb/articles/820"
77,https://bodybio.com/collections/gut,Product Category Page,,Modal dialog container,,Filter,This modal dialog is missing necessary ARIA attributes. ,4.1.2 (WCAG 2.0 A),Visual,"Ensure the attributes `role=""dialog""` and `aria-modal=""true""` are present on the wrapper element of this modal dialog. Do not [add these attributes](https://hub.accessible360.com/kb/articles/820#heading--do-not-dynamically-add-these-attributes-while-a-users-focus-is-inside) dynamically after the user's focus has been moved to it or into it.",Serious,,Modal Dialogs,112,588,Open,Open,,,,,,,,,,Audit Session,Audit Session,https://hub.accessible360.com/screenshots/1633264,https://hub.accessible360.com/screenshots/1633264,https://hub.accessible360.com/issues/575779/edit,"https://hub.accessible360.com/kb/articles/113, https://hub.accessible360.com/kb/articles/820, https://hub.accessible360.com/kb/articles/1001"
79,https://bodybio.com/collections/gut,Product Category Page,,"""Filters""",,Filter,Text that functions as a heading should be marked up as such.,1.3.1 (WCAG 2.0 A),Visual,"Mark this text up as a heading.

Headings provide structure for screen reader users. When marking text up as a heading, verify that the page maintains a logical outline structure. For example; 

- Each page needs a single `<h1>` heading that describes the main purpose of the page.
- An `<h2>` should head each major section of the page.
- Subsequent heading levels (`<h3>` through `<h6>`) should be related to a parent `<h2>` and should not skip heading levels.",Serious,,Headings,106,15,Open,Open,,,,,,,,,,Audit Session,Audit Session,https://hub.accessible360.com/screenshots/1633400,https://hub.accessible360.com/screenshots/1633400,https://hub.accessible360.com/issues/575797/edit,https://hub.accessible360.com/kb/articles/63
80,https://bodybio.com/collections/gut,Product Category Page,,"""Filters""",,Filter,"When content is marked up as a button, but is not semantically a button, it can be confusing for screen reader users.",1.3.1 (WCAG 2.0 A),Visual,Remove the `<button>` markup together with `aria-expanded`.,Serious,,Markup,4,1466,Open,Open,,,,,,,,,,Audit Session,Audit Session,https://hub.accessible360.com/screenshots/1633409,https://hub.accessible360.com/screenshots/1633409,https://hub.accessible360.com/issues/575798/edit,https://hub.accessible360.com/kb/articles/1094
81,https://bodybio.com/collections/gut,Product Category Page,,Filter radio buttons,,Filter,Toggle buttons need to convey their state to screen reader users.,4.1.2 (WCAG 2.0 A),Visual,"Add an `aria-pressed` attribute to this button. Ensure that the `aria-pressed` attribute correctly reflects the state of the button. The value of the attribute should be set to ""true"" when the button is pressed and ""false"" when it's not pressed.",Serious,,Buttons,98,1373,Open,Open,,,,,,,,,,Audit Session,Audit Session,https://hub.accessible360.com/screenshots/1633417,https://hub.accessible360.com/screenshots/1633417,https://hub.accessible360.com/issues/575799/edit,
82,https://bodybio.com/collections/gut,Product Category Page,,Product cards,,Product Cards,This component was audited previously.,"1.3.1 (WCAG 2.0 A), 1.4.13 (WCAG 2.1 AA), 2.1.1 (WCAG 2.0 A), 2.4.4 (WCAG 2.0 A)","Cognitive,Motor / Dexterity,Visual","We use reference issues to reduce the overall volume of project issues and track the locations of recurring content. Apply the fixes used to resolve the [Product Cards (Cards and Tiles)](/project_components/53620) to the same content that is present on this view. 

Once all of the original component’s Related Issues have been resolved, we will review this instance of the component to ensure all of the fixes were properly applied. This issue’s priority level will be adjusted to match the highest remaining priority of the unresolved issue(s) in the referenced component.

**All of the issues described in the component must be resolved in order for this issue to be marked Complete.**",Critical,,Reference,59,320,Open,Open,,,,,,Yes,,,,Audit Session,Audit Session,,,https://hub.accessible360.com/issues/575800/edit,https://hub.accessible360.com/kb/articles/1186
83,https://bodybio.com/collections/gut,Product Category Page,,Page headings,,,This page contains one or more heading levels in an illogical order.,1.3.1 (WCAG 2.0 A),Visual,"Verify that the page maintains a logical outline structure. For example, 

- Each page needs a single `<h1>` heading that describes the main purpose of the page.
- An `<h2>` should head each major section of the page.
- Subsequent heading levels (`<h3>` through `<h6>`) should be related to a parent `<h2>` and should not skip heading levels.

---

We recommend that you develop a plan to address heading levels at the global/site-wide level, as it is important to identify a pattern for headings and ensure the pattern is followed consistently across all pages. Please reach out via our help desk or by contacting your Allyant Customer Success Manager if you require assistance. Please see this [Knowledge Base article](https://hub.accessible360.com/kb/articles/74) for more information about heading level structure.",Warning,,Headings,106,40,Open,Open,,,,,,Yes,,,,Audit Session,Audit Session,,,https://hub.accessible360.com/issues/575802/edit,https://hub.accessible360.com/kb/articles/74
142,https://bodybio.com/collections/gut,Product Category Page,,Filter button (when a filter is applied),,,Accessible names of elements should properly match the visible labels.,2.5.3 (WCAG 2.1 A),Visual," To resolve this issue, please implement one of the following options:

1. If using an `aria-label` or `aria-labelledby` attribute, preferably remove the attribute from the element.
2. Adjust the [accessible name](https://webaim.org/articles/label-name) to match or at least contain the visible text as written. For better usability, this should be placed at the beginning of the accessible name, but this is not required.",Serious,,Textual content,116,515,Open,Open,,,,,,,,,,Audit Session,Audit Session,https://hub.accessible360.com/screenshots/1640025,https://hub.accessible360.com/screenshots/1640025,https://hub.accessible360.com/issues/577429/edit,https://hub.accessible360.com/kb/articles/751
143,https://bodybio.com/collections/gut,Product Category Page,,Filter button (when a filter is applied),,,The meaning of this number is not clear to screen reader users. ,1.3.1 (WCAG 2.0 A),Visual,"Add some screen reader only text describing the context of this value , for example: ""active"". 

If going for the second approach in issue #142, this text should instead be appended to the accessible name (in this case the `aria-label`).",Serious,,Textual content,116,574,Open,Open,,,,,,,,,,Audit Session,Audit Session,https://hub.accessible360.com/screenshots/1640036,https://hub.accessible360.com/screenshots/1640036,https://hub.accessible360.com/issues/577462/edit,https://hub.accessible360.com/kb/articles/1178
144,https://bodybio.com/collections/gut,Product Category Page,,Modal dialog,,Filter,Keyboard and screen reader users do not have their focus moved to this modal dialog when it opens.,2.4.3 (WCAG 2.0 A),"Motor / Dexterity,Visual","Set the keyboard focus to the [most appropriate element](https://hub.accessible360.com/kb/articles/820#heading-moving-focus-into-a-modal-dialog-when-it-opens) inside this modal dialog, depending on the content it contains. All of the following solutions are acceptable, and you are free to decide which solution feels the most ""appropriate"" to you in this use case.

1. To the close (X) button, if one is used.
1. To the visible heading that labels the modal dialog, if one is used.
1. To the modal dialog wrapper itself (the element with both `role=""dialog""` and `aria-modal=""true""`).
1. To the primary call to action (CTA) element (such as an ""OK"" button), or the element for the least destructive action in a set of CTAs (like ""Cancel"" next to a button for ""Delete"").

**Note:** in order to set focus on an element that cannot natively receive focus (like a heading or the wrapper element), add the attribute `tabindex=""-1""` to it.",Serious,,Modal Dialogs,112,7,Open,Open,,,,,,,,,,Audit Session,Audit Session,,,https://hub.accessible360.com/issues/577467/edit,"https://hub.accessible360.com/kb/articles/36, https://hub.accessible360.com/kb/articles/820"
151,https://bodybio.com/collections/gut,Product Category Page,Yes,For example: Not selected view type button.,,Color & Contrast,This graphical object does not meet the minimum color contrast required by the WCAG. The combination of grey (C2CAD3) and light blue (#ECF7FB) only has a contrast ratio of #1.51:1.,1.4.11 (WCAG 2.1 AA),Visual,"The visual presentation of this graphical object should be modified to have a contrast ratio of at least 3:1 with the adjacent color.

**Note:** the color combination specified in this issue’s example may also be present elsewhere on your site. We recommend careful review and monitoring of all site colors (including instances of essential graphical objects) to ensure ongoing, site wide compliance with color contrast requirements.",Serious,,Color and contrast,5,586,Open,Open,,,,,,,,,,Audit Session,Audit Session,https://hub.accessible360.com/screenshots/1642628,https://hub.accessible360.com/screenshots/1642628,https://hub.accessible360.com/issues/578449/edit,"https://hub.accessible360.com/kb/articles/863, https://hub.accessible360.com/kb/articles/864"
84,https://bodybio.com/products/bodybio-balance-oil?variant=34379592827015,Product Detail Page,,Page headings,,,This page contains one or more heading levels in an illogical order.,1.3.1 (WCAG 2.0 A),Visual,"Verify that the page maintains a logical outline structure. For example, 

- Each page needs a single `<h1>` heading that describes the main purpose of the page.
- An `<h2>` should head each major section of the page.
- Subsequent heading levels (`<h3>` through `<h6>`) should be related to a parent `<h2>` and should not skip heading levels.

---

We recommend that you develop a plan to address heading levels at the global/site-wide level, as it is important to identify a pattern for headings and ensure the pattern is followed consistently across all pages. Please reach out via our help desk or by contacting your Allyant Customer Success Manager if you require assistance. Please see this [Knowledge Base article](https://hub.accessible360.com/kb/articles/74) for more information about heading level structure.",Warning,,Headings,106,40,Open,Open,,,,,,Yes,,,,Audit Session,Audit Session,,,https://hub.accessible360.com/issues/575810/edit,https://hub.accessible360.com/kb/articles/74
85,https://bodybio.com/products/bodybio-balance-oil?variant=34379592827015,Product Detail Page,,Carousel,,Product Gallery,It is not clear to screen reader users where the carousel begins or ends.,1.3.1 (WCAG 2.0 A),Visual,"Wrap the carousel in either a `<section>` or a `<div role=""region"">` tag. Be sure to add an `aria-label` containing the word ""carousel"" to this wrapper element. When there are multiple carousels on a page, ensure that each has a unique `aria-label`. See the KB article's [section on carousel wrappers](https://hub.accessible360.com/kb/articles/476#heading-wrapper) for more information.",Serious,,Carousels,100,469,Open,Open,,,,,,,,,,Audit Session,Audit Session,https://hub.accessible360.com/screenshots/1633567,https://hub.accessible360.com/screenshots/1633567,https://hub.accessible360.com/issues/575813/edit,"https://hub.accessible360.com/kb/articles/476, https://hub.accessible360.com/kb/articles/133"
86,https://bodybio.com/products/bodybio-balance-oil?variant=34379592827015,Product Detail Page,,Carousel,,Product Gallery,It may not be clear to screen reader users how to interact with this carousel.,1.3.1 (WCAG 2.0 A),Visual,Add screen-reader-only text as the first child element of this carousel that succinctly and accurately describes the available functionality. Refer to the [guidance on screen-reader-only instructions](https://hub.accessible360.com/kb/articles/476#heading-instructions-for-people-using-screen-readers) in the Carousels and Sliders Knowledge Base article to learn more.,Warning,,Carousels,100,470,Open,Open,,,,,,,,,,Audit Session,Audit Session,https://hub.accessible360.com/screenshots/1633564,https://hub.accessible360.com/screenshots/1633564,https://hub.accessible360.com/issues/575814/edit,"https://hub.accessible360.com/kb/articles/476, https://hub.accessible360.com/kb/articles/1178"
87,https://bodybio.com/products/bodybio-balance-oil?variant=34379592827015,Product Detail Page,,Non-visible carousel slides,,Product Gallery,Content within non-visible slides can receive keyboard focus and is visible to screen reader users at all times.,4.1.2 (WCAG 2.0 A),"Motor / Dexterity,Visual","Hide all non-visible carousel slides by adding `aria-hidden=""true""` attributes to the elements wrapping each inactive slide and  `tabindex=""-1""` attributes on each focusable elements within those slides.  See the [guidance on hiding inactive slides](https://hub.accessible360.com/kb/articles/476#heading-slides) in the Carousels and Sliders Knowledge Base article.",Serious,,Carousels,100,471,Open,Open,,,,,,,,,,Audit Session,Audit Session,,,https://hub.accessible360.com/issues/575815/edit,https://hub.accessible360.com/kb/articles/476
88,https://bodybio.com/products/bodybio-balance-oil?variant=34379592827015,Product Detail Page,,Currently selected carousel control,,Product Gallery,Screen readers are unable to determine which slide dot or thumbnail image button is currently active.,1.4.1 (WCAG 2.0 A),Visual,"Place an `aria-current=""true""` attribute on the currently active slide dot or thumbnail button. See the guidance on [slide dot buttons](https://hub.accessible360.com/kb/articles/476/#heading-slide-dots) or [thumbnail image buttons](https://hub.accessible360.com/kb/articles/476/#heading-product-images) in the Carousels and Sliders Knowledge Base article.",Serious,,Carousels,100,476,Open,Open,,,,,,,,,,Audit Session,Audit Session,https://hub.accessible360.com/screenshots/1633562,https://hub.accessible360.com/screenshots/1633562,https://hub.accessible360.com/issues/575816/edit,https://hub.accessible360.com/kb/articles/476
89,https://bodybio.com/products/bodybio-balance-oil?variant=34379592827015,Product Detail Page,,Thumbnail image buttons,,Product Gallery,"These are buttons, but they are not marked up as such; screen readers will not identify them as actionable and they will not be usable by keyboard users.","2.1.1 (WCAG 2.0 A), 4.1.2 (WCAG 2.0 A)","Motor / Dexterity,Visual","Preferably, buttons should be marked up as semantic HTML `<button>` elements.

Less preferably, ensure that custom button elements include `role=""button”` and `tabindex=“0”`, and have the appropriate scripting in place so that the element can be selected by keyboard users using the `Enter` key and `Space` key, and by mouse click.",Critical,,Buttons,98,84,Open,Open,,,,,,Yes,,,,Audit Session,Audit Session,https://hub.accessible360.com/screenshots/1633560,https://hub.accessible360.com/screenshots/1633560,https://hub.accessible360.com/issues/575817/edit,"https://hub.accessible360.com/kb/articles/127, https://hub.accessible360.com/kb/articles/59"
90,https://bodybio.com/products/bodybio-balance-oil?variant=34379592827015,Product Detail Page,,Each slide,,Product Gallery,It is difficult for screen reader users to identify when one slide ends and the next begins.,1.3.1 (WCAG 2.0 A),Visual,"Add `role=""group""` and `aria-label=""slide X of Y""` attributes to the element containing each slide.",Serious,,Carousels,100,477,Open,Open,,,,,,,,,,Audit Session,Audit Session,https://hub.accessible360.com/screenshots/1633553,https://hub.accessible360.com/screenshots/1633553,https://hub.accessible360.com/issues/575818/edit,https://hub.accessible360.com/kb/articles/476
91,https://bodybio.com/products/bodybio-balance-oil?variant=34379592827015,Product Detail Page,,Thumbnail buttons,,Product Gallery,The thumbnail navigation images for this carousel are not correctly labeled.,2.1.1 (WCAG 2.0 A),"Motor / Dexterity,Visual","Give each `<button>` element wrapping the thumbnail images an appropriate `aria-label` that explains its purpose, for example: ""image 1 of 5"". Alternatively, the thumbnail `alt` attributes could be updated to label the buttons. See [this section of the our Knowledge Base](https://hub.accessible360.com/kb/articles/476#heading-product-images) article for further information.  ",Serious,,Carousels,100,668,Open,Open,,,,,,,,,,Audit Session,Audit Session,https://hub.accessible360.com/screenshots/1633551,https://hub.accessible360.com/screenshots/1633551,https://hub.accessible360.com/issues/575819/edit,https://hub.accessible360.com/kb/articles/476
92,https://bodybio.com/products/bodybio-balance-oil?variant=34379592827015,Product Detail Page,,Carousel,,Product Gallery,Carousel has no controls.,"1.3.1 (WCAG 2.0 A), 4.1.2 (WCAG 2.0 A)",Visual,"Provide carousel controls such as well labelled ""Previous"" and ""next"" buttons.
Please use approach found on [this](https://hub.accessible360.com/kb/articles/476#heading-product-images) article.",Serious,,Carousels,100,1597,Open,Open,,,,,,,,,,Audit Session,Audit Session,,,https://hub.accessible360.com/issues/575820/edit,https://hub.accessible360.com/kb/articles/476
93,https://bodybio.com/products/bodybio-balance-oil?variant=34379592827015,Product Detail Page,,Nutrition images,,Product Gallery,"This nutrition information is an image, and is inaccessible to screen reader and magnification users.  ","1.1.1 (WCAG 2.0 A), 1.3.1 (WCAG 2.0 A)",Visual,"Nutritional information labels can be challenging to structure in a way that makes it accessible for screen reader users to understand. The best approach that we know involves using headings and nested lists to convey the data and their relationships, and CSS for all of the visual styling.

Preferably, instead of keeping the text inside the image: 

1. Mark this up using HTML and CSS, [as shown in this code sample](https://codepen.io/A360/pen/2fe0b1f1e69c3a1827c4b1cf871534bd).

Alternatively, if the preferred remediation option is not feasible, you must do the following for this issue to be considered complete:

1. Give the image an `alt` attribute value of ""Nutrition label"" (or similar) so that it is generally clear what it contains.
1. Add the text from this image using adjacent HTML, but make it visible only to screen readers, [as shown in this code sample](https://codepen.io/A360/pen/3751166b110ebd3ddfed8904d56169d0?editors=1000).
1. Ensure that the image is reasonably readable up to 200% zoom.
1. Consult with your legal counsel to determine the impact this approach may have on your risk profile.
1. Document your findings and decision as a comment on this issue as a protective record-keeping measure.",Serious,,Images,1,322,Open,Open,,,,,,,,,,Audit Session,Audit Session,https://hub.accessible360.com/screenshots/1633544,https://hub.accessible360.com/screenshots/1633544,https://hub.accessible360.com/issues/575821/edit,
94,https://bodybio.com/products/bodybio-balance-oil?variant=34379592827015,Product Detail Page,,Main image wrapper,Thumbnail image buttons wrapper,Product Gallery,Unactionable elements should not have tabindex=”0”.,2.1.1 (WCAG 2.0 A),"Motor / Dexterity,Visual","Remove the `tabindex=""0""` attribute from each element so that they do not receive tab focus.",Warning,,Focus,2,565,Open,Open,,,,,,Yes,,,,Audit Session,Audit Session,https://hub.accessible360.com/screenshots/1633556,https://hub.accessible360.com/screenshots/1633556,https://hub.accessible360.com/issues/575823/edit,
